{
  "report_identity": {
    "report_id": "CR-0001-EXAMPLE",
    "report_type": "Release-Compliance",
    "generated_at": "2026-01-22T00:00:00Z"
  },
  "subject": {
    "name": "9DA-Core",
    "version": "1.0.0",
    "scope": "Single-Repository"
  },
  "governing_references": {
    "architecture": "9DA-Core/ARCHITECTURE.md",
    "dependency_matrix": "9DA-Core/DEPENDENCY-MATRIX.md",
    "ethics": "9DA-Core/ETHICS.md",
    "release_process": "9DA-Core/RELEASE-PROCESS.md",
    "metrics": "9DA-Core/METRICS.md"
  },
  "compliance_evaluations": {
    "architecture": { "validated": true, "violations": 0 },
    "dependencies": { "validated": true, "cycles_detected": 0 },
    "adrs": { "coverage_complete": true, "unaccepted_count": 0 },
    "ethics": { "validated": true, "violations": 0 },
    "integration_tests": { "pass_rate": 100 },
    "metrics": { "thresholds_met": true }
  },
  "violations": [],
  "evidence": {
    "ci_runs": ["TBA"],
    "artifacts": []
  },
  "certification_status": {
    "compliant": true,
    "certification_level": "9DA-Certified"
  },
  "audit_metadata": {
    "audited_by": "CI-System",
    "auditor_role": "CI-System",
    "audit_date": "2026-01-22"
  }
}
